_id,NAME,ROUTE NO,DISTRICT,HOW NAMED,FROM,TO
218,PFC George Howell Memorial Highway,101,5,"ACR 202, CH 170,  2022",Sala Road OC# 44-0283 (PM 92.190),Prunedale South Road OC# 44-0284 (PM 94.071)
219,CHP Officer Artie J. Hubbard Memorial Freeway,5,3,"SCR 12, CH 73, 2005",Southern Boundary of the City of Sacramento,Pocket Road
220,"Kern County Deputy Sheriff William ""Joe"" Hudnall, Jr., Memorial Highway",178,6,"ACR 90, CH 71, 2008",Post Mile 13.7 at the mouth of Kern Canyon,Kernville Road/Route 155
221,Leo Stanley Hulett Highway,101,1,"SCR 61, CH 21, 1990",0.5 miles south of Haehl overhead,0.5 miles north of Reynolds Highway
222,Ben Hulse Highway,78,"11, 8","AB 2499, CH 1387, 1961, changed by SCR 70, CH 121, 2004","Route 111, east of Brawley",I-10 near Blythe
223,Solano County Deputy Sheriff Hale Humphrey Memorial Highway,12,4,"ACR 177, CH 135, 2016",Pennsylvania Avenue (PM R4.072) ,Marina Boulevard (PM 5.150)
224,Los Angeles County Sheriff’s Deputy Didier M. Hurdle Memorial Highway,105,7,"ACR 214, CH 170 2018",Junction of Interstate 110 (PM R7.386),Long Beach Blvd UC# 53-2493 (PM R11.506)
225,Officer Richard Hyche Memorial Freeway,10,8,"SCR 95, CH 93, 2006",Euclid Avenue,6th Street overcrossing
226,George Alan Ingalls Memorial Highway,198,6,"ACR 47, CH 60, 2001",Twelfth Avenue,Seventh Avenue
227,Officer Jimmy Arty Inn Memorial Highway,4,10,"ACR 195, CH 164, 2022",N JCT RTE 5 (PM R16.059),JCT 99 (PM R19.407)
228,CHP Officers Irvine and Stovall Memorial Highway,166,5,"SCR 79, CH 65, 1998",Route 101 near Santa Maria,Route 33 in the Cuyama Valley
229,Deputy Sheriff Brian “Ish” Ishmael Memorial Highway,50,3,"SCR 89, CH 34, 2020","Missouri
Flat Road OC# 25-121 (Postmile R15.061)",Ray Lawyer Drive OC# 25-117 (Postmile 16.523)
230,“CAL FIRE Firefighter Cory Iverson Memorial Highway”,15,11,"ACR 205, CH 152 2018",Via Rancho Parkway OC# 57-623 (PM M26.970),Junction with State Route 78 (PM R31.517)
231,"Sheriff’s Deputies Ronald Wayne Ives and Daniel Jess Lobo, Jr., Memorial Highway",15,8,"ACR 123, CH 119, 2016",Junction with Route 210 (PM 8.094),Sierra Avenue UC# 54-981 (PM 12.871)
232,Robert M. Jackson Memorial Highway,89,10,"SCR 57, CH 27, 2006",Alpine/Mono County Line,Route 4
233,CHP Officer Paul C. Jarske Memorial Highway,101,1,"ACR 76, CH 114, 2011",Branscomb Road - PM 69.490,PM 74.490
234,United States Army Private First Class Conrado D. Javier Memorial Highway,218,5,"SCR 57, CH 21 2018",Junction of 1/218 (PM R0.000),Junction of 68/218 (PM 1.956)
235,Lance Corporal Javier Olvera Memorial Highway,14,7,"SCR 60, CH 6, 2014",JCT 14/138 SEP 53-1419RT - PM R59.783,WEST AVE O-8 UC# 53-2379LT - PM R62.129
236,Senator Jenny Oropeza Memorial Freeway,710,7,"SCR 115, CH 130, 2014",PICO AVENUE NB ONRAMP OH# 53-2785S - PM 5.820,JCT RTE 1/710 SEP# 53-725 - PM 6.881
237,Joe Gatto Memorial Highway,10,7,"ACR 173, CH 184, 2014",JCT RTE 5/10 SEP# 53-1329 - PM 18.394,JCT RTE 710/10 SEP# 55-1445 - PM 21.382
238,CDF Firefighter John D. Guthrie Memorial Highway,215,8,"ACR 107, CH 80, 2008 & ACR 162, CH 160, 2014","N JCT 74, BR# 56-458 - PM 26.308",NB ON FROM RAMONA EXPWY - PM R31.075
239,John Steinbeck Highway,101,5,"ACR 67, CH 141, 2014",JCT ROUTE 68 WEST/JOHN STREET PM - 86.815,ESPINOZA ROAD/RUSSELL ROAD PM - R91.900
240,San Jose Police Officer Michael Johnson Memorial Highway,87,4,"ACR 88, CH 186, 2015",JCT ROUTE 87/85 APPROX - PM 0.156,JCT ROUTE 87/ 280 - PM5.156
241,Paul Johnson Highway,55,12,"ACR 179, CH 160, 2010",Katella Avenue,Chapman Avenue
242,Robert Scott Johnson Memorial Highway,1,5,"ACR 47, CH 135, 2021",Exit 404 - SB OFF to Fremont Blvd/Del Monte Blvd (PM R80.970),Exit 406 - SB OFF to Lightfighter Drive (PM R82.759)
243,"Harold  T. ""Bizz"" Johnson Expressway",65,3,"ACR 92, CH 88, 1986",I-80,Blue Oaks Boulevard
244,Ray E. Johnson Expressway,99,3,"ACR 74, CH 113, 1993",Pentz Road overcrossing at Post Mile 23.863,"Edgar Slough, Bridge No. 12-0128, PM 30.040"
245,El Monte Police Officer Donald Ralph Johnston Memorial Highway,10,7,"ACR 71, CH 115, 2003",Route 164 (signed as Route 19) in the City of Rosemead - PM26.857,I-605 in the City of Baldwin Park - PM 31.151
246,Ohlone Kallentaruk Highway,129,5,"ACR 100, CH 101, 2012",Blackburn Street - PM 0.540,Murphy Crossing Road - PM 4.742
247,CDF Firefighter Chris Kanton Memorial Highway,10,8,"ACR 10, CH 64, 2007",Beaumont Avenue/Route 79 exit,Sunset Avenue exit
248,Officer and Medal of Valor Recipient Waldron G. Karp Memorial Highway,5,12,"ACR 149, CH 144, 2018",Northbound Tustin Ranch Road (PM 28.224),Southbound Tustin Ranch Road (PM R28.456)
249,Michael “Mike” Jason Katherman Memorial Highway,85,4,"ACR 173, CH 160, 2022",JCT 87/85 (PM 5.222),Almaden Expwy UC#37-530 (PM 6.136)
250,Senator David G. Kelley Highway,86,8,"ACR 106, CH 108, 2000",82nd Avenue,66th Avenue
251,Officer Justin Kepler Memorial Highway,120,10,"ACR 119, CH 38, 2020",Sexton Road (Postmile 14.830),Brennan Avenue (Postmile 15.860)
252,Kern County Korean War Veterans Memorial Highway,58,6,"ACR 209, CH 194, 2004",Route 184,Kern County/San Bernardino County Line
253,Kern County Korean War Veterans Memorial Highway,99,6,"ACR 46, CH 54, 2001","I-5, 3.5 miles south of Mettler",Northern Kern County Line at County Line Road (J44) in Delano
254,Officer Kevin Tonn Memorial Highway,99,3,"SCR 74, CH 74, 2014",WITH IN THE CITY OF GALT FROM (PM 0.000),WITH IN THE CITY OF GALT TO (PM 2.050)
255,"Martin Luther King, Jr. Freeway",94,11,"SCR 67, CH 129, 1989",I-5 in the City of San Diego,Route 125
256,John T. Knox Freeway ,580,4,"SCR 50, CH 78, 1980","I-80, the Albany Interchange",Richmond-San Rafael Bridge
257,Deran Koligian Memorial Highway,180,6,"SCR 94, CH 158, 2002","Route 33 (and, upon completion, from Route 5)",Route 99
258,Quentin L. Kopp Freeway,380,4,"SCR 99, CH 145, 1998",Route 1 near Pacifica,Route 101 near South San Francisco
259,Korean War Veterans Memorial Highway ,37,4,"SCR 28, CH 64, 2021",Atherton Avenue UC# 27-79 (PM 13.773),Junction of 37/121 (PM 3.900)
260,Korean War Veterans' Memorial Highway,126,7,"SCR 41, CH 131, 1994 & ACR 135, CH 89, 2002",Route 101 near Ventura,I-5 near Santa Clarita
261,Costa Mesa Fire Captain Michael Kreza Memorial Highway,55,12,"SCR 21, CH 139, 2019",19th Street (Postmile 2.021),MacArthur Blvd UC# 55-410 (Postmile R6.969)
262,Kumeyaay Highway,8,11,"ACR 57, CH 112, 1997 & ACR 156, CH 90, 2002","Nimitz Boulevard in Mission Bay, City of San Diego",San Diego/Imperial County Line
263,Milton La Malfa Memorial Highway,99,3,"ACR 71, CH 107, 2009",Oroville Dam Boulevard West PM 13.161,Nelson Avenue PM 15.170
264,Laguna Freeway ,133,12,"By Commission, 11/26/1957",I-5,Laguna Beach
265,Officer David Lamoree Memorial Highway,12,4,"ACR 7, CH 121, 2007",Olsen Road,Route 113
266,William H. Lancaster Memorial Highway,210,"7, 8","ACR 2, CH 76, 2003",City of Duarte,I-15 exit
267,Lieutenant Jared M. Landaker Memorial Highway,38,8,"ACR 59, CH 115, 2007",Post Mile 49.530/Route 18,Post Mile 59.396/Route 18
268,Detectives Mike Lane and John Pierce Memorial Highway,72,7,"ACR 62, CH 139, 2013",COSTA GLEN AVENUE - PM 0.601,PENN STREET - PM 4.856
269,Frank Lanterman Freeway ,2,7,"ACR 131, CH 126, 1978",Route 134 in Glendale,I-210 in La Canada Flintridge
270,"Staff Sergeant Salvador J. Lara, Staff Sergeant Ysmael R. Villegas, and Sergeant Jesus S. Duran Memorial Highway",91,8,"SCR 38, CH 111, 2015",MADISON SREET UC#56-384L/R - PM 16.651,THIRD STREET UC#53-316 - PM 20.845
271,Tommy Lasorda Memorial Highway ,5,12,"ACR 67, CH 115, 2021",Ball Road OC# 55-670 (PM 37.638),Eastbound Exit State 91 (PM 42.671)
272,Lassen State Highway,299,2,"CH 498, 1911",Shasta/Lassen County Line,Lassen/Modoc County Line
273,Glendale Police Officer Charles A. Lazzaretto Memorial Freeway,134,7,"ACR 67, CH 97, 1999",I-5,Route 2
274,CAL FIRE Firefighter Christopher Lee Douglas Memorial Highway,10,8,"SCR 22, CH 107, 2015",22ND STREET UC#56-430 - PM R11.962,MALKI/FIELDS ROAD UC#56-454 - PM R16.544
275,Army Specialist Roger Lee Memorial Highway,68,5,"ACR 203, CH 166, 2022",Morse Drive (PM 2.260),Skyline Forest Drive (PM 3.370)
276,Deputy Bruce Lee Memorial Highway,111,8,"SCR 5, CH 15, 2005",Jefferson Street,Washington Street
277,"Sergeant Darrell Keith Lee, Sergeant Gary Wayne Wolfley, and Officer Sergio Carrera Jr. Memorial Highway",10,8,"ACR 100, CH 109, 2012",Cedar Avenue OC# 54-35 - PM R18.492,Pepper Avenue OC# 54-531 - PM 20.965
278,"William ""Bill"" Lehn Memorial Highway",99,6,"ACR 30, CH 82, 2003",Mountain View Avenue overcrossing,San Joaquin River an the Fresno/Madera County Line
279,"Willliam Alexander Leidesdorff, Jr. Memorial Highway",50,3,"ACR 131, CH 41, 2004",Bradshaw Road,Sacramento/El Dorado County Line
280,Police Officer Tyler “Ty” Lenehan Memorial Highway,99,3,"ACR 194, CH 169, 2022",Grant Line Road OC# 24-155 (PM 10.070),Sheldon Road OC# 24-374 (PM 14.869)
281,Marine Corporal Christopher D. Leon Memorial Highway,14,7,"SCR 5, CH 70, 2009",Avenue M,Avenue L
282,Joe Levy Memorial Highway,41,6,"SCR 45, CH1, 2016",Bullard Avenue OC# 42-303 (PM R29.463),Herdon Avenue UC# 42-305 (PM R30.447)
283,E.G. Lewis Highway,41,5,"ACR 76, CH 47, 1994",Route 1,Route 101
284,Willard F. Libby Memorial Highway,116,4,"ACR 149, CH 128, 1984",Forestville,Sebastopol
285,Donald Mark Lichliter Memorial Highway,12,10,"ACR 100, CH 109, 2012","JCT 99, North BR# 29-140 - PM 18.080",POSTMILE MARKER - 23.080
286,James Lick Memorial Freeway,101,4,"ACR 37, CH 122, 1951",San Mateo/San Francisco County Line,I-80
287,CHP Sergeant Steven L. Licon Memorial Highway,15,8,"ACR 107, CH 36, 2020",Junction with Route 74 at (PM 22.277),Lake Street UC# 56-682 (PM 26.688)
288,CHP Officer Charles Lilly Memorial Highway,101,4,"SCR 100, CH 109, 2012",JCT 87/101 SEP 37-183 PM 39.925,Fair Oaks Avenue OC 37-168 PM 44.831
289,Steven Lindblom Memorial Freeway,99,6,"ACR 35, CH 83, 2003",Southern city limits of Madera ,Madera/Merced County Line
290,R. Kirk Lindsey Memorial Highway,108,10,"SCR 54, CH 79, 2010",Five Points,City of Riverbank
291,"CHP Officer Stephen M. Linen, Jr. Memorial Freeway",5,11,"SCR 24, CH 127, 2003",Leucadia Boulevard,La Costa Avenue
292,Ort J. Lofthus Freeway,4,10,"ACR 95, CH 51, 1986",I-5,Route 99
293,Long Beach Freeway ,710,7,By Commission 11/18/1954,Route 1 in Long Beach,I-5 in Commerce
294,Los Angeles County Vietnam Veterans Memorial Highway,1,7,"ACR 115, CH 94, 2000",,
295,"Colonel William R. ""Bill"" Lucius Highway",101,4,"SCR 73, CH 15, 1990",Russian River south of Healdsburg,Mendocino County Line
296,Senator Paul J. Lunardi Memorial Highway,267,3,"SCR 23, CH 141, 2015",PM 4.898,END OF ROUTE 267 - PM 9.898
297,Police Sergeant Scott Lunger Memorial Highway ,4,4,"ACR 49, CH 133, 2017",Laurel Road OC #28-390 (PM R31.368),Balfour Road (PM R35.598)
298,CHP Officer Christopher D. Lydon Memorial Freeway,67,11,"ACR 53, CH 88, 1999",I-8 in El Cajon,Mapleview Street in Lakeside
299,MacArthur Freeway,580,4,"ACR 27, CH 156, 1968",Route 238,I-880
300,Detective Jeremiah MacKay Memorial Highway,38,8,"ACR 68, CH 142, 2013",PM 24.000,PM 29.000
301,Kenneth L. Maddy Freeway,99,10,"SCR 25, CH 85, 1997",0.3 mile south of Dwight Way,0.1 mile south of August Avenue
302,Alex Madonna Memorial Highway,101,5,"ACR 97, CH 83, 2006",Madonna Road exit in San Luis Obispo,Santa Barbara Road in Atascadero
303,"Officer Sixto Maldonado, Jr., Memorial Highway",33,6,"ACR 128, CH 75, 2008",Bullard Avenue,Douglas Avenue
304,CalFire Firefighter Andrew Maloney Memorial Highway ,165,10,"ACR 47, CH 132, 2017",Pioneer Road (PM 7.782),Berkeley Drive (PM 8.140)
305,CHP Officer David W. Manning Memorial Freeway,178,6,"SCR 50, CH 117, 2004",M Street,Fairfax Road
306,CHP Officer Erick S. Manny Memorial Highway,5,6,"ACR 58, CH 114, 2007",Fort Tejon exit (Exit 210),Grapevine exit (Exit 215)
307,Captain Matthew Patrick Manoukian Memorial Highway,280,4,"ACR 151, CH 132, 2022","JCT 85/280 
(PM 10.741)",NB OFF TO El Monte Road (PM 14.844)
308,Specialist Manuel Joaquin Holguin Memorial Highway,245,6,"ACR 135, CH 85, 2014",Avenue 364 - PM 9.970,Avenue 398 - PM 14.970
309,Marin County Veterans Memorial Freeway,101,4,"ACR 5, CH 49, 1999",Lucas Valley Road in San Rafael,Two miles north of Lucas Valley Road
310,Marina Freeway ,90,"7, 12","SCR 59, CH 25, 1976",Route 1,Route 91
311,CHP Officer Johnny R. Martinez Memorial Highway,10,7,"ACR 159, CH 104, 2010",eastbound milepost marker 22.31,westbound milepost marker 22.33
312,CHP Officer Saul Martinez Memorial Highway,86,8,"SCR 100, CH 109, 2012",5 MILES SOUTH FROM JCT RTE 10 PM R18.000,"JCT 10, RT LANES PM R23.000"
313,Officer Robert Joe Mata and Officer Roberto C. Sanchez Memorial Highway,110,7,"ACR 12, CH 151, 2015",EXIT 1A / BEG OF RTE 110 - PM 0.744,EXIT 1B / NB OFF TO CHANNEL AND PACIFIC - PM 1.390
314,Martin A. Matich Highway,210,8,"ACR 156, CH 156, 2006",I-215 at Post Mile 21.84,I-10 at Post Mile 33.0
315,Donna P. Mauzy Memorial Freeway,8,11,"ACR 93, CH 127, 2001",Route 67,Greenfield Drive
316,Doctor June McCarroll Memorial Freeway,10,8,"SCR 58, CH 105, 2000",Jefferson Street and Indio Boulevard Interchange,Route 86
317,California Highway Patrol Officer Justin W. McGrory Memorial Highway,15,8,"ACR 37, CH 49, 2011",Wild Wash RD OC #54-565 - PM 55.957,Hodge RD OC 54-566 - PM 60.159
318,"John McVeigh, Jr. Memorial Highway",198,5,"ACR 119, CH 147, 1994",Route 101,Monterey/Fresno County Line
319,Christopher Meadows Memorial Highway,101,5,"ACR 100, CH 109, 2012",NB off to SAN LUIS BAY DR - PM R22.150,NB off to MADONNA RD - PM 27.400
320,Medal of Honor Memorial Highway,215,8,"ACR 230, CH 156 2018",Barton Road Overcrossing OC # 54-528 (Postmile 1.312),Orange Show Road Overcrossing OC # 54-473 (Postmile 5.025)
321,Jerry Medina Memorial Highway,99,10,"ACR 168, CH 140, 2002",Tuolumne Boulevard,Standiford Avenue/Beckwith Road
322,Jere Melo Memorial Highway,1,1,"ACR 100, CH 109, 2012",Chestnut Street - PM 60.925,Elm Street - PM 61.993
323,Betty Meltzer Memorial Highway,82,4,"SCR 30, CH 74, 2009",Page Mill Road (PM 24.04),San Francisquito Creek (SCL/SM County Line 26.37)
324,Joel Mendenhall Memorial Highway,76,11,"ACR 4, CH 113, 2015",PM 42.790,E PALOMAR RD LT T - PM 47.790
325,Deputy Sheriff Merrit W. Deeds Memorial Highway,116,4,"ACR 159, CH 177, 2014",JCT RTE 1 - PM 0.000,PM 5.000
326,Officer Michael Crain Memorial Highway,91,8,"ACR 134, CH 84, 2014",La Sierra Avenue OC 56-425 - PM 11.991,Madison Street UC 56-384 - PM 16.651
327,Military Intelligence Service Memorial Highway,23,7,"ACR 62, CH 115, 1994",Route 101,Route 118
328,Military Servicewomen's Memorial Highway,101,4,"ACR 171, CH 154, 1998",San Mateo/Santa Clara County Line,Ralston Avenue exit in Belmont
329,"Officer Russell M. Miller, Sr. Memorial Highway",60,7,"SCR 83, CH 122, 2010",Mountain Avenue,Ramona Avenue
330,CHP Officer John P. Miller Memorial Highway,580,4,"ACR 78, CH 110, 2009","Airway Boulevard, Post Mile 14.98","North Flynn Road, Post Mile 6.00"
331,Fortuna Police Officer Raymond Quincy Mills Memorial Highway,101,1,"SCR 98, CH 107, 2022",Kenmar Road UC# 4-128 (PM 59.503),Palmer Blvd UC# 4-112 (PM 62.229)
332,Norman Y. Mineta Highway,85,4,"ACR 25, CH 66, 2007",Route 101 in San Jose to Quito Road,Prospect Road to Route 101 in Mountain View
333,Sergeant 1st Class Sean K. Mitchell Memorial Highway,1,5,"ACR 204, CH 167, 2022",Postmile R75.500,Iris Canyon Road UC END BR 44-0192 LT (PM R76.500)
334,Officer David F. Mobilio Memorial Highway,5,2,"SCR 78, CH 88, 2012",Riverside Ave OC# 8-113 - PM R23.384,North Red Bluff OC# 8-98 - PM R28.377
335,Mojave Freeway,15,8,"ACR 47, CH 117, 1987",I-215 at Devore,Nevada State Line
336,Frank F. Momyer Bypass,108,10,"ACR 112, CH 97, 1986",Route 120,Route 49
337,Robert T. Monagan Freeway,205,"4, 10","ACR 75, CH 128, 1985",I-580,I-5
338,Officer John Paul Monego Memorial Freeway,680,4,"SCR 60, CH 114, 2000",I-580,Alcosta Boulevard
339,Mono Lake Basin Road,120,9,"CH 704, 1917",Route 395,Mono Mills (Site)
340,John J. Montgomery Freeway,5,11,"ACR 16, CH 83, 1949",Mexico International Border at Tijuana,Route 94 in San Diego
341,Archie Moore Memorial Freeway,15,11,"ACR 90, CH 141, 1999",Ocean View Boulevard exit,Home Avenue exit
342,Moreno Valley Freeway,60,8,"SCR 45, CH 103, 1989",Route 91,I-10
343,Mother Lode Highway,49,"10, 3","CH 839, 1921",Sonora,Auburn
344,"CHP Officer Andre Maurice Moye, Jr. Memorial Freeway",215,8,"SCR 7, CH 80, 2021",Eucalyptus Avenue OC# 56-757 (PM R37.436),Junction State Route 60/215 SEP# 56-507R (PM R38.339)
345,CHP Officer Daniel J. Muehlhausen Memorial Highway,62,8,"ACR 29, CH 90, 2003",5.4 miles west of junction with Route 177,4.6 miles east of junction with Route 177
346,Muir Woods Toll Road,,4,"CH 634, 1935",Route 1,Junction of Panoramic Hwy
347,Willard H. Murray Freeway,91,7,"ACR 78, CH 135, 1997",Central Avenue,Alameda Street
348,National Purple Heart Trail,"5, 80","11, 12, 7, 6, 10, 3, 2 & 4, 3","SCR 14, CH 79, 2001",Mexico International Border (Tijuana) and San Francisco,Oregon State Line (Henley) and Nevada State Line
349,National Purple Heart Trail,45,3,"ACR 191, CH 163, 2016",Beg of Colusa County (PM 0.000),End of Colusa County (PM 34.176)
350,National Purple Heart Trail,20,3,"ACR 191, CH 163, 2016",Beg of Colusa County (PM 0.000),End of Colusa County (PM R39.340)
351,National Purple Heart Trail,5,3,"ACR 191, CH 163, 2016",Beg of Colusa County (PM  R0.000),End of Colusa County (PM R34.365)
352,National Purple Heart Trail,16,3,"ACR 191, CH 163, 2016",Beg of Colusa County (PM 0.000),End of Colusa County (PM 7.256)
353,CHP Officer Sean Nava Memorial Freeway,5,11,"SCR 24, CH 127, 2003",Tamarack Avenue,Route 78
354,Needles Freeway,40,8,"SCR 1, 1968",I-15,Arizona State Line
355,Lieutenant Colonel Seth “Jethro” Nehring Memorial Highway,168,6,"ACR 164, CH 136, 2022",Lodge Road (PM L27.368),Qualls Prather Road (PM L28.250)
356,CHP Officer Dale E. Newby Memorial Highway,5,10,"SCR 89, CH 155, 2002",French Camp Road,Eight Mile Road
357,CHP Officer Archie E. Nichols Memorial Highway,99,2,"SCR 105, CH 117 2018",9th Avenue (Postmile 16.266) ,61st Avenue (Postmile 16.700)
358,Nels Dan Niemi Memorial Highway,880,4,"SCR 41, CH 91, 2007",Washington Avenue,Marina Boulevard
359,Nimitz Freeway,880,4,"SCR 23, CH 84, 1958",Route 101,I-80
360,Robert and Pat Nimmo Memorial Highway,41,5,"ACR 122, CH 94, 2008",El Camino Real,Creston Road
361,First Lady Pat Nixon Memorial Highway,91,7,"SCR 68, CH 103, 2022","Pioneer Blvd UC# 53-
1335 (PM R18.087)",Carmenita Rd OC# 53-1432 (PM R20.454)
362,Richard “Dick” Noles Memorial Highway,168,9,"ACR 115, CH 118, 2016",4090 West Line Street = Approx. Red Hill Road (PM 15.075),North junction with State Route 395 (PM 18.310)
363,Nomlaki Highway,5,2,"SCR 15, CH 93, 2007",Gyle Road,Flores Avenue
364,Northern Yosemite Highway,120,10,"ACR 27, CH 69, 1989",San Joaquin/Stanislaus County Line near Escalon,Yosemite National Park
365,Norwalk Freeway,105,7,"ACR 46, CH 362, 1969",I-405,Route 605 near the City of Norwalk
366,"Colonel Young Oak Kim, United States Army, Memorial Highway",5,12,"ACR 188, CH 122, 2018",Eastbound exit State Route 91 exit (Postmile 42.671),The boundary with the Los Angeles County (Postmile 44.382)
367,President Barack H. Obama Highway,134,7,"SCR 8, CH 147, 2017",State Highway Route 2 (PM R8.963),Junction of Interstate 210 (PM R13.341)
368,Chiura Obata Great Nature Memorial Highway,120,9,"ACR 112, CH 37, 2020",(PM R0.000),(PM 5.000)
369,Caltrans Highway Maintenance Leadworker Jaime Obeso Memorial Highway,8,11,"SCR 52, CH 94, 2011",Postmile Marker 11-IMP-008-R30.925,Postmile Marker 11-IMP-008-R31.425
370,Ocean Beach Freeway ,8,11,"ACR 117, CH 233, 1968",Sunset Cliffs Boulevard,I-5 in San Diego
371,Jack O'Connell Highway,46,5,"ACR 78, CH 135, 1997",Route 101 in Paso Robles,Roue 41 at Cholame
372,Ojai Freeway,33,7,By Location,Route 101,Foster Park
373,Ramon Ojeda Memorial Highway,78,11,"ACR 47, CH 100, 2006",Route 67,Third Street
374,CHP Officer Hugo Olazar Memorial Highway,280,4,"SCR 36, CH 127, 1999",San Jose/Sickles Avenue onramp,San Jose Avenue overcrossing
375,Deputy Sheriff Danny P. Oliver Memorial Highway,50,3,"SCR 152, CH 184, 2016",Cambridge Road OC #25-83 (PM 4.962),Cameron Park Drive UC #25-84 (PM 6.570)
376,Ontario Freeway,15,8,"ACR 10, CH 136, 1989","Limonite Avenue exit, south of Route 60 interchange",I-215 at Devore
377,Orange Freeway,57,"12, 7","ACR 17, CH 157, 1969",Route 1,Route 60 near the City of Diamond Bar
378,Orange County Korean War Veterans Memorial Highway,1,12,"ACR 29, CH 100, 2001",I-5 near San Juan Capistrano,Golden West Street in Huntington Beach
379,Orange County Veterans Memorial Highway,133,12,"SCR 74, CH 96, 1998",Route 1,Junction with Eastern Transportation Corridor
380,Los Angeles County Deputy Sheriff Jerry Ortiz Memorial Highway,60,7,"ACR 27, CH 68, 2007",Rosemead Boulevard/Route 19,I-605
381,California Highway Patrol Officer Phillip Dennis Ortiz Memorial Highway,405,7,"ACR 41, CH 52, 2011",JCT ST 187 Venice Blvd - PM 27.964,National Blvd - PM 29.163
382,Oscar Rios Highway,129,5,"ACR 67, CH 141, 2014",JCT RTE 1 SEP# 36-91 - PM L0.000,BLACKBURN STREET - PM 0.540
383,Ventura County Fire Engineer Ryan Osler Memorial Highway,101,7,"ACR 135, CH 142, 2018",Seward Avenue OC# 52-216 (PM 28.452) ,Vista Del Mar UC# 52-152 (PM 29.458 – Mid bridge point)
384,La Habra Police Officer Michael Anthony Osornio Memorial Highway,39,12,"SCR 78, CH 88, 2012",South City Limits La Habra - PM 18.846,North City Limits La Habra - PM 22.660
385,Los Angeles County Sheriff’s Sergeant Steven C. Owen Memorial Highway ,14,7,"ACR 31, CH 135, 2017",E Avenue S UC# 53-1417 (PM R58.172),E Avenue R End of BR# 53-1440 (PM R59.167)
386,Pacific Coast Highway,1,"12, 7","AB 1769, CH 1569, 1959, Streets & Highways Code Section 635",San Juan Capistrano,El Rio
387,Ronald Packard Parkway,78,11,"ACR 165, CH 124, 2000",I-5,I-15
388,Esther Padilla Memorial Highway,168,6,"ACR 139, CH 43, 2020","Junction
with State Route 180 (Postmile R0.000R)",East Shields Avenue OC# 42-0338 (Postmile R2.017)
389,Officer John Palacios Memorial Highway,269,6,"SCR 14, CH 92, 2007",Route 198,Five Points/Route 145
390,Senior Master Sergeant John James Paoletti Memorial Highway,5,12,"ACR 208, CH 171, 2022",El Horno Street UC#55-230 (PM 10.001),Crown Valley Parkway OC# 55-444 (PM 13.776)
391,Louis J. Papan Highway,1,4,"ACR 234, CH 176, 2002",Southern city limits of Pacifica,Skyline Boulevard/Route 35
392,"Deputy Sheriff Robert “Bob” Paris, Jr., Memorial Highway",88,10,"ACR 179, CH 161, 2018",Comstock Road (PM 4.935),East Harney Lane (PM 9.610)
393,Rosa Parks Freeway,10,7,"ACR 134, CH 2, 2002",I-405 - PM R5.430,I-110 - PM 14.836
394,Rosa Parks Highway,58,6,"ACR 136, CH 110, 2002",Route 99,Route 184
395,Pasadena Freeway ,110,7,By Commission 11/18/1954,Route 101 (4-level Structure),Pasadena
396,U.S. Army SP4 Dwayne M. Patterson Memorial Highway,111,11,"SCR 15, CH 83, 2021",(Postmile 33.000),(Postmile 37.600)
397,Joash E. Paul Memorial Highway,99,10,"ACR 19, CH 81, 2003",Stanislaus/Merced County Line,Mitchell Road
398,Burbank Police Officer Matthew Pavelka Memoria Freeway,5,7,"ACR 156, CH 150, 2004",West Burbank Boulevard,Hollywood Way
399,Pearl Harbor Memorial Highway,10,"7, 8","SCR 8, CH 72, 2005",Santa Monica,Arizona State Line
400,Pearl Harbor Survivors Memorial Highway,99,6,"SCR 13, CH 81, 1993",Tulare,Fresno
401,CHP Officer John Pedro Memorial Highway,1,5,"SCR 67, CH 118, 2004",Pajaro River Bridge,Harkins Slough Road
402,"Fire Chief F. S. ""Pete"" Pedroza Memorial Highway",111,11,"SCR 64, CH 116, 2004",I-8,East Jasper Road near the City of Calexico
403,"California Highway Patrol Officers James E. Pence, Jr., Roger D. Gore, Walter C. Frago, and George M. Alleyn Memorial Highway",5,7,"SCR 93, CH 92, 2006",Magic Mountain Parkway,Rye Canyon Road undercrossing
404,Police Officer Richard Perkins Memorial Highway,395,9,"SCR 46, CH 53, 2004",Warm Springs Road,Southern City Limits of Bishop
405,Officer Pepe Petersen Memorial Highway,99,10,"SCR 46, CH 162, 2019",Arch Road UC# 29-316 (Postmile 14.568),Mariposa Road OC# 29.157 (Postmile 16.698)
406,Petroleum Highway,33,6,"ACR 185, CH 128, 2004",Route 166,Route 46
407,Deputy Sheriff Dennis E. Phelps Memorial Highway,168,6,"SCR 17, CH 106, 2003",Temperance Avenue,Shepherd Avenue
408,Westminster Police Officer Steven L. Phillips Memorial Highway,39,12,"ACR 70, CH 132, 2005",I-405,Route 22
409,Medal of Honor Recipient Larry Stanley Pierce Memorial Highway,46,6,"ACR 60, CH 68, 2009","Western City Limits, City of Wasco","Eastern City Limits, City of Wasco"
410,David E. Pierson and Bill Freeman Highway,86,11,"ACR 23, CH 68, 1989",San Felipe Creek Bridge at Route 78,Imperial/Riverside County Line
411,Gateway to the Pinnacles Highway,101,5,"ACR 67, CH 141, 2014",Exit 301 SB ON FROM ARROYO SECO - PM 60.150,Exit 305 SB ON FROM CAMPHORA/GLORIA - PM 64.410
412,Paul H. Pino Memorial Highway,395,9,"SCR 55, CH 50, 2006",Gill Station Coso Road,Route 190
413,Lewis E. Platt Memorial Highway,87,4,"SCR 37, CH 96, 2007",I-280,Julian Street/Santa Clara Street exit
414,Officer Jack Polen Memorial Highway,44,2,"ACR 135, CH 121, 2016",Wilson Hill Road (PM R27.882) ,Airport Way (PM 35.930)
415,Pomona Freeway,60,"7, 8",By Commission 11/15/1955,I-5,Route 83 in Chino
416,Harold Del Ponte Memorial Highway,101,1,"SCR 124, CH 119 2018",The county border of Del Norte and Humboldt (Postmile M0.000),(Postmile R2.000)
417,Senator Chuck Poochigian Highway,180,6,"SCR 103, CH 87, 2008",Clovis Avenue,General Grant Grove Park
418,Portola Freeway ,380,4,"ACR 113, CH 217, 1970",Route 1,Route 101 near San Francisco International Airport
419,Post No. 1747 Veterans of Foreign Wars of the United States Memorial Highway,70,3,"ACR 149, CH 97, 2000",Pacific Heights/Georgia Way,Westbound ramp to Garden Drive
420,LA County Deputy Sheriff David Powell Memorial Highway,91,7,"ACR 30, CH 47, 2009",Route 605,Pioneer Boulevard
421,Deputy Sheriff Sandra Powell-Larson Memorial Highway,5,3,"SCR 96, CH 113, 2006",Q Street,J Street
422,Deputy Frank M. Pribble Memorial Highway,10,8,"ACR 96, CH 72, 2008",Post Mile 12.25,Post Mile 15.25
